<?xml version="1.0" encoding="utf-8"?>
<xs:schema xmlns:xsi="http://www.w3.org/2001/XMLSchema-instance" attributeFormDefault="unqualified" elementFormDefault="qualified" xmlns:xs="http://www.w3.org/2001/XMLSchema">
<xs:simpleType name="quantityType">
        <xs:restriction base="xs:integer">
            <xs:minInclusive value="1" />
        </xs:restriction>
    </xs:simpleType>  
    <xs:simpleType name="prodType">
      <xs:restriction base="xs:string">
          <xs:pattern value="p[0-9]{3}"/>
      </xs:restriction>
      </xs:simpleType>
<xs:element name="products">
    <xs:complexType>
      <xs:sequence>
        <xs:element name="product" maxOccurs="unbounded">
          <xs:complexType>
            <xs:sequence>
              <xs:element name="title" type="xs:string" />
              <xs:element name="description" type="xs:string" />
              <xs:element name="unitPrice" type="xs:decimal" />
              <xs:element name="quantity" type="quantityType" />
              <xs:element name="img">
                <xs:complexType>
                  <xs:attribute name="src" type="xs:string" use="required" />
                </xs:complexType>
              </xs:element>
            </xs:sequence>
            <xs:attribute name="id" type="prodType" use="required" />
          </xs:complexType>
        </xs:element>
      </xs:sequence>
    </xs:complexType>
  </xs:element>
</xs:schema>