<?xml version="1.0" encoding="utf-8"?>
<?xml-stylesheet href="product1.xsl" type="text/xsl"?>
<products xmlns:xsi="http://www.w3.org/2001/XMLSchema-instance"
    xsi:noNamespaceSchemaLocation="product.xsd">
    <product id="p001">
        <title>Shoes</title>
        <unitPrice>50</unitPrice>
        <quantity>5</quantity>
        <img src="shoe.jpeg"></img>
        <link>shoe.html</link>
        This is a shoe </product>
    <product id="p001">
        <title>Shoes</title>
      
        <unitPrice>50</unitPrice>
        <quantity>100</quantity>
        <img src="shoe.jpeg"></img>
        <link>shoe.html</link>
        This is a shoe </product>
    <product id="p001">
        <title>Shoes</title>
        <unitPrice>50</unitPrice>
        <quantity>100</quantity>
        <img src="shoe.jpeg"></img>
        <link>shoe.html</link>
        This is a shoe </product>
</products>